{
  "brand": "RUMBLING STONE · ARC-09 P2D",
  "title": "Il Palio di Channathgate",
  "subtitle": "Tre giorni di intrighi, otto contrade, novanta secondi di guerra",
  "banner": "BOOKLET COMPLETO",
  "meta": "Un'avventura D&D 3.5 per 4 personaggi di 13° livello · Valle di Channath, estate del 1372 DR (finestra Day 25-34) · Campagna privata basata su Red Hand of Doom · materiale del DM — 14 capitoli, contenuto integrale dei master P2D",
  "colophon": {
    "edizione": "Edizione da tavolo",
    "versione": "v1",
    "data": "2026-09-02",
    "basato_su": "D&D 3.5 SRD · OGL 1.0a · adattamento privato di «Red Hand of Doom» (Wizards of the Coast)",
    "licenza": "Materiale del DM, per uso privato al tavolo. Non ridistribuire: contiene materiale derivato da un'avventura pubblicata — vedi docs/guides/GUIDA-CONDIVISIONE-IP.md e ADR-0005."
  },
  "header": "I 14 capitoli integrali del side-arc P2D (ARC-09) in stile Manuale del Giocatore — nessun taglio: è il contenuto completo dei file master, con stemmi e mappe vettoriali della campagna. Materiale del DM.",
  "footer": "Il Palio di Channathgate",
  "intro_md": "PALIO-BOOKLET-INTRO.md",
  "out": "PALIO-BOOKLET.html",
  "chapters": [
    {
      "title": "✉ Teaser giocatori — «Novanta Secondi»",
      "file": "PALIO-TEASER-GIOCATORI.md",
      "tag": "player"
    },
    {
      "title": "I · La Città e i Distretti",
      "file": "../Arco-Post-Hammerfist-P2D-PALIO-DISTRETTI-CHANNATHGATE.md",
      "tag": "dm"
    },
    {
      "title": "II · L'Avventura (regole base)",
      "file": "../Arco-Post-Hammerfist-P2D-PALIO-CHANNATHGATE-AVVENTURA.md",
      "tag": "dm"
    },
    {
      "title": "III · Le Contrade — Stemmi e Canti",
      "file": "../Arco-Post-Hammerfist-P2D-PALIO-CONTRADE-STEMMI-CANTI.md",
      "tag": "dm"
    },
    {
      "title": "IV · Le Ballate (i Ritornelli)",
      "file": "../Arco-Post-Hammerfist-P2D-PALIO-BALLATE.md",
      "tag": "dm"
    },
    {
      "title": "V · Le Prove di Ammissione",
      "file": "../Arco-Post-Hammerfist-P2D-PALIO-PROVE-AMMISSIONE.md",
      "tag": "dm"
    },
    {
      "title": "VI · Giorno 1 — La Tratta",
      "file": "../Arco-Post-Hammerfist-P2D-PALIO-GIORNO1-TRATTA.md",
      "tag": "dm"
    },
    {
      "title": "VII · Le Prove di Batteria",
      "file": "../Arco-Post-Hammerfist-P2D-PALIO-PROVE-BATTERIA.md",
      "tag": "dm"
    },
    {
      "title": "VIII · Giorno 2 — Partiti, Cena, Sabotaggi",
      "file": "../Arco-Post-Hammerfist-P2D-PALIO-GIORNO2-PARTITI-CENA-SABOTAGGI.md",
      "tag": "dm"
    },
    {
      "title": "IX · Giorni 3-4 — La Corsa e gli Esiti",
      "file": "../Arco-Post-Hammerfist-P2D-PALIO-GIORNO3-4-CORSA-ESITI.md",
      "tag": "dm"
    },
    {
      "title": "X · DM Master Reference",
      "file": "../Arco-Post-Hammerfist-P2D-PALIO-DM-MASTER-REFERENCE.md",
      "tag": "dm"
    },
    {
      "title": "XI · Integrazione di Campagna",
      "file": "../Arco-Post-Hammerfist-P2D-PALIO-CHANNATHGATE-INTEGRAZIONE.md",
      "tag": "dm"
    },
    {
      "title": "XII · Conseguenze ed Echi",
      "file": "../Arco-Post-Hammerfist-P2D-PALIO-CONSEGUENZE-ECHI.md",
      "tag": "dm"
    },
    {
      "title": "XIII · Statblocchi",
      "file": "../Arco-Post-Hammerfist-P2D-PALIO-STATBLOCCHI.md",
      "tag": "dm"
    },
    {
      "title": "XIV · Le Mappe",
      "file": "../Arco-Post-Hammerfist-P2D-PALIO-MAPPE.md",
      "tag": "dm"
    }
  ],
  "fregio": "../../docs/assets/fregi/fregio-arco-09-continuazione.svg"
}
