{
  "brand": "RUMBLING STONE · ARC-07 · IL PORTALE DELLA FORGIA ETERNA",
  "title": "La Resurrezione e i Mille Anni",
  "subtitle": "Il risveglio nella Forgia · il rito del Cuore di Moradin · Hammerfist mille anni fa, fino all'alba",
  "banner": "BOOKLET DI SESSIONE",
  "meta": "Sessione D&D 3.5 per 4 personaggi di 13° livello (Hella torna al rito) · Faerûn, Flamerule 1372 DR e ≈372 DR · Campagna privata RumblingStone · regia DM, cast ed echi, master DEF-2/3/4 integrali, handout per PG",
  "header": "La serata del 2026-09-25: regia in ordine di gioco, il cast con gli echi, i tre master integrali e le pagine da consegnare. I capitoli ⚠ sono del DM; le pagine ✉ si consegnano ai giocatori quando la regia lo dice.",
  "footer": "La Resurrezione e i Mille Anni",
  "player_footer": "Il Cuore e la Porta",
  "colophon": {
    "edizione": "Booklet di sessione",
    "versione": "v1",
    "data": "2026-09-24",
    "autori": "Il DM di RumblingStone, con l'agente di scrittura del repo",
    "basato_su": "D&D 3.5 SRD (OGL 1.0a); adattamento privato di Red Hand of Doom (Wizards of the Coast, 2006)",
    "licenza": "materiale del DM, uso privato del tavolo, non diffondere"
  },
  "cover_image": "../../Immagini/web/ilCuoreDiMoradin.jpg",
  "intro_md": "00-INTRO-DOVE-SIAMO.md",
  "out": "ARC07-SERATA-RESURREZIONE-BOOKLET.html",
  "chapters": [
    {"title": "I · Regia della serata", "file": "01-REGIA-SERATA.md", "tag": "dm"},
    {"title": "II · Il cast e i suoi echi", "file": "02-CAST-ED-ECHI-PNG.md", "tag": "dm"},
    {"title": "La cassetta del DM — cast, pronuncia, read-aloud, suoni", "file": "../../ARC07-CASSETTA-DEL-DM.md", "tag": "dm"},
    {"title": "III · Master — Il Ritorno e gli Affreschi (DEF-2)", "file": "../../ARC07-DEF-2-RITORNO-E-AFFRESCHI.md", "tag": "dm"},
    {"title": "IV · Master — La Resurrezione di Hella (DEF-3)", "file": "../../ARC07-DEF-3-RESURREZIONE-HELLA.md", "tag": "dm"},
    {"title": "V · Master — Il Viaggio a 1.000 anni fa (DEF-4)", "file": "../../ARC07-DEF-4-VIAGGIO-MILLE-ANNI.md", "tag": "dm"},
    {"title": "Collana dei Semi Eterni — scheda DM", "file": "../../../PG/Artefatti/Artefatti-Pg/Hella/01_Collana_dei_Semi_Eterni.md", "tag": "dm"},
    {"title": "✉ Echi — Thorik", "file": "03-ECHI-THORIK.md", "tag": "player"},
    {"title": "✉ Echi — Tordek", "file": "04-ECHI-TORDEK.md", "tag": "player"},
    {"title": "✉ Echi — Artemis", "file": "05-ECHI-ARTEMIS.md", "tag": "player"},
    {"title": "✉ Echi — Hella", "file": "06-ECHI-HELLA.md", "tag": "player"},
    {"title": "✉ La preghiera della resurrezione", "file": "10-HANDOUT-PREGHIERA.md", "tag": "player"},
    {"title": "✉ Le carte dei Doni", "file": "07-CARTE-DEI-DONI.md", "tag": "player"},
    {"title": "✉ Hella, tornata", "file": "09-SCHEDA-HELLA-RISORTA.md", "tag": "player"},
    {"title": "✉ Durik, il guardiano di pietra", "file": "08-SCHEDA-DURIK.md", "tag": "player"},
    {"title": "✉ Le Cronache dei Quattro Eroi", "file": "../HANDOUT-1-cronache-quattro-eroi.hb.md", "tag": "player"}
  ],
  "fregio": "../../../docs/assets/fregi/fregio-arco-07-forgia.svg"
}
